{
  "attempt_id": "550e8400-e29b-41d4-a716-446655440000",
  "order_id": "550e8400-e29b-41d4-a716-446655440001",
  "operation": "SUBMIT",
  "client_order_id": "c1",
  "broker": "qmt",
  "account_id": "a",
  "expected_order_version": 2,
  "fencing_token": 1,
  "started_at": "2026-07-02T02:00:00Z",
  "cancel_request_id": "550e8400-e29b-41d4-a716-446655440000"
}
